{
  "generated_at": "2026-10-22T17:58:11Z",
  "candidate_version": "0.4.0",
  "skill_version": "0.4.0",
  "modules": [
    {
      "module_id": "core",
      "phases": [
        1,
        2,
        3,
        4,
        5,
        6,
        7,
        8,
        9,
        10,
        11,
        12,
        13,
        14,
        15,
        16,
        17,
        18,
        19,
        20,
        21,
        22,
        23,
        24,
        25,
        26,
        27,
        28,
        29,
        30,
        31,
        32,
        33,
        34,
        35,
        36,
        37,
        38,
        39,
        40,
        41,
        42,
        43,
        44,
        45,
        46,
        47,
        48,
        49,
        50,
        51,
        52,
        53,
        54,
        55,
        56,
        57,
        58,
        59,
        60
      ],
      "activation": "core_required",
      "corpus_ref": null,
      "gate": {
        "kind": "pytest",
        "target": "tests/",
        "command": "python3 -m pytest tests/ -q --no-header --ignore=tests/test_release_candidate.py"
      },
      "exit_code": 0,
      "ok": true,
      "limitations": [
        "Las pruebas cubren comportamiento local, no el corpus real."
      ],
      "gate_detail": ".................................................................... [ 67%]\n........................................................................ [ 73%]\n........................................................................ [ 78%]\n........................................................................ [ 84%]\n........................................................................ [ 90%]\n........................................................................ [ 95%]\n....................................................                     [100%]\n1274 passed, 2 skipped in 135.89s (0:02:15)\n"
    },
    {
      "module_id": "mdx",
      "phases": [
        61,
        62,
        63,
        64,
        65,
        66,
        67,
        68,
        69,
        70
      ],
      "activation": "dormant_by_default",
      "corpus_ref": "evals/cases/mdx.md",
      "gate": {
        "kind": "pytest",
        "target": "tests/test_mdx_*.py",
        "command": "python3 -m pytest tests/test_mdx_assemble.py tests/test_mdx_attributes.py tests/test_mdx_contract.py tests/test_mdx_gate.py tests/test_mdx_parser.py tests/test_mdx_props.py tests/test_mdx_protect.py tests/test_mdx_review.py tests/test_mdx_selector.py tests/test_mdx_tabs.py -q",
        "test_files": [
          "tests/test_mdx_assemble.py",
          "tests/test_mdx_attributes.py",
          "tests/test_mdx_contract.py",
          "tests/test_mdx_gate.py",
          "tests/test_mdx_parser.py",
          "tests/test_mdx_props.py",
          "tests/test_mdx_protect.py",
          "tests/test_mdx_review.py",
          "tests/test_mdx_selector.py",
          "tests/test_mdx_tabs.py"
        ]
      },
      "exit_code": 0,
      "ok": true,
      "limitations": [
        "La evidencia es de clasificación y contrato, no de traducción completa con el módulo activo.",
        "La paridad de render en el destino no está comprobada.",
        "Los fixtures de tests/fixtures/mdx/ son sintéticos; el corpus que justifica la activación es el piloto.",
        "No existe ningún archivo .mdx real en el repositorio: el corpus usa componentes MDX dentro de .md.",
        "No hay ningún archivo .mdx real: el corpus usa componentes MDX dentro de .md."
      ],
      "gate_detail": "...............................................................          [100%]\n63 passed in 0.60s\n"
    },
    {
      "module_id": "html",
      "phases": [
        71,
        72,
        73,
        74,
        75,
        76,
        77,
        78,
        79,
        80
      ],
      "activation": "dormant_by_default",
      "corpus_ref": "evals/cases/html.md",
      "gate": {
        "kind": "pytest",
        "target": "tests/test_html_*.py",
        "command": "python3 -m pytest tests/test_html_assemble.py tests/test_html_attributes.py tests/test_html_classify.py tests/test_html_contract.py tests/test_html_gate.py tests/test_html_malformed.py tests/test_html_matrix.py tests/test_html_parser.py tests/test_html_release_gate.py tests/test_html_selector.py tests/test_html_tables.py -q",
        "test_files": [
          "tests/test_html_assemble.py",
          "tests/test_html_attributes.py",
          "tests/test_html_classify.py",
          "tests/test_html_contract.py",
          "tests/test_html_gate.py",
          "tests/test_html_malformed.py",
          "tests/test_html_matrix.py",
          "tests/test_html_parser.py",
          "tests/test_html_release_gate.py",
          "tests/test_html_selector.py",
          "tests/test_html_tables.py"
        ]
      },
      "exit_code": 0,
      "ok": true,
      "limitations": [
        "Conservar HTML no demuestra que el importador de destino lo soporte.",
        "El corpus que lo activa es sintético o inexistente: evals/cases/html.md",
        "El corpus que lo activa es sintético: los corpus autorizados contienen 0 etiquetas del contrato.",
        "La paridad de render en el destino no está comprobada.",
        "Los corpus autorizados contienen 0 etiquetas del contrato HTML: solo lo activan fixtures sintéticos.",
        "reports/pilot/profile.json y reports/beta/profile.json activaron html.enabled sin corpus que lo justificara; se declara como activación inmotivada y no se corrigen porque su hash está anclado en el manifiesto del piloto."
      ],
      "gate_detail": "........................................................................ [ 91%]\n.......                                                                  [100%]\n79 passed in 3.37s\n"
    },
    {
      "module_id": "markdown-extensions",
      "phases": [
        81,
        82,
        83,
        84,
        85,
        86,
        87,
        88,
        89,
        90
      ],
      "activation": "dormant_by_default",
      "corpus_ref": "evals/cases/markdown-extensions.md",
      "gate": {
        "kind": "pytest",
        "target": "tests/test_*extensions*.py",
        "command": "python3 -m pytest tests/test_admonitions.py tests/test_content_gates.py tests/test_definition_lists.py tests/test_dialect_matrix.py tests/test_directives.py tests/test_extension_combinations.py tests/test_footnotes.py tests/test_frontmatter_translate.py tests/test_math.py tests/test_mermaid_labels.py tests/test_wikilinks.py -q",
        "test_files": [
          "tests/test_admonitions.py",
          "tests/test_content_gates.py",
          "tests/test_definition_lists.py",
          "tests/test_dialect_matrix.py",
          "tests/test_directives.py",
          "tests/test_extension_combinations.py",
          "tests/test_footnotes.py",
          "tests/test_frontmatter_translate.py",
          "tests/test_math.py",
          "tests/test_mermaid_labels.py",
          "tests/test_wikilinks.py"
        ]
      },
      "exit_code": 0,
      "ok": true,
      "limitations": [
        "El corpus piloto declara una admonition que en realidad es un atributo de Pandoc dentro de un fence: la medición de evals/cases/markdown-extensions.md §1 lo corrige.",
        "El corpus que lo activa es sintético o inexistente: evals/cases/markdown-extensions.md",
        "Footnotes y matemáticas no tienen interruptor: el núcleo los trata siempre, y su contract dice que están siempre activos.",
        "Footnotes y matemáticas no tienen interruptor: el núcleo los trata siempre.",
        "Todos los fixtures del lote son sintéticos.",
        "Todos los fixtures del lote son sintéticos: ningún corpus autorizado contiene estas construcciones."
      ],
      "gate_detail": "........................................................................ [ 83%]\n..............                                                           [100%]\n86 passed in 1.05s\n"
    },
    {
      "module_id": "terminology",
      "phases": [
        91,
        92,
        93,
        94,
        95,
        96,
        97,
        98,
        99,
        100
      ],
      "activation": "dormant_by_default",
      "corpus_ref": "evals/cases/terminology.md",
      "gate": {
        "kind": "pytest",
        "target": "tests/test_glossary_*.py + tests/test_term_*.py",
        "command": "python3 -m pytest tests/test_glossary_database.py tests/test_glossary_frontend.py tests/test_glossary_ml_ai.py tests/test_glossary_network.py tests/test_glossary_systems.py tests/test_term_drift.py tests/test_term_precedence.py tests/test_term_profiles.py tests/test_term_provenance.py tests/test_term_report.py -q",
        "test_files": [
          "tests/test_glossary_database.py",
          "tests/test_glossary_frontend.py",
          "tests/test_glossary_ml_ai.py",
          "tests/test_glossary_network.py",
          "tests/test_glossary_systems.py",
          "tests/test_term_drift.py",
          "tests/test_term_precedence.py",
          "tests/test_term_profiles.py",
          "tests/test_term_provenance.py",
          "tests/test_term_report.py"
        ]
      },
      "exit_code": 0,
      "ok": true,
      "limitations": [
        "El corpus que lo activa es sintético o inexistente: evals/cases/terminology.md",
        "Los 11 términos pendientes del corpus Beta (reports/core/PREGUNTAS-PENDIENTES.md §1) no los cubre ninguna herramienta del módulo.",
        "Los cinco perfiles de dominio son de laboratorio y no los activa ningún glosario real.",
        "Los cinco perfiles de dominio son de laboratorio: llevan corpus_real false y no los activa ningún glosario real.",
        "Los fixtures declaran decided_by example-agent, que no es una persona."
      ],
      "gate_detail": ".............................................................            [100%]\n61 passed in 0.15s\n"
    },
    {
      "module_id": "language",
      "phases": [
        101,